{"action_dim":120,"action_horizon":32,"action_rep":"mix","bundle_root":"/absolute/RoboTactile/deployment/artifacts/models/ftp1_policy","camera_route":"head","checkpoint_name":"FTP1_UniVTAC_insert_hole_expert_gsmall_ftp1","checkpoint_repository":"MJJJJ1064/ftp1_univtac_finetune","checkpoint_revision":"620ac69b4fffd2341300cfef1b1d224d56710ed3","checkpoint_root":"/absolute/RoboTactile/deployment/artifacts/models/ftp1_policy/FTP1_UniVTAC_insert_hole_expert_gsmall_ftp1/19999","checkpoint_step":19999,"chunk_first_n":20,"chunk_index_offset":1,"color_contract":"upstream_passthrough_v1","domain_name":"UniVTAC_insert_hole","external_commit":"89fa681d6c014cce28300946b7526db808e0b1c1","gemma_terms_uri":"https://ai.google.dev/gemma/terms","hpt_gelsight_path":"/absolute/RoboTactile/deployment/artifacts/models/ftp1_policy/FTP1_UniVTAC_insert_hole_expert_gsmall_ftp1/19999/hpt_tokenizer/GelSightMini_image_224_224_3.safetensors","hpt_gelsight_sha256":"0000000000000000000000000000000000000000000000000000000000000000","hpt_shared_path":"/absolute/RoboTactile/deployment/artifacts/models/ftp1_policy/FTP1_UniVTAC_insert_hole_expert_gsmall_ftp1/19999/hpt_tokenizer/shared_image_chunk_encoder.safetensors","hpt_shared_sha256":"0000000000000000000000000000000000000000000000000000000000000000","model_config_path":"/absolute/RoboTactile/deployment/artifacts/models/ftp1_policy/FTP1_UniVTAC_insert_hole_expert_gsmall_ftp1/19999/model_config.json","model_config_sha256":"0000000000000000000000000000000000000000000000000000000000000000","model_path":"/absolute/RoboTactile/deployment/artifacts/models/ftp1_policy/FTP1_UniVTAC_insert_hole_expert_gsmall_ftp1/19999/model.safetensors","model_sha256":"0000000000000000000000000000000000000000000000000000000000000000","normalization_files":[{"path":"action_group_frequency_stats_train.json","sha256":"0000000000000000000000000000000000000000000000000000000000000000"},{"path":"dataset_stats.json","sha256":"0000000000000000000000000000000000000000000000000000000000000000"},{"path":"UniVTAC_insert_hole/contact_detection_thresholds.json","sha256":"0000000000000000000000000000000000000000000000000000000000000000"},{"path":"UniVTAC_insert_hole/independent_norm_stats_all_t0_zscore.json","sha256":"0000000000000000000000000000000000000000000000000000000000000000"},{"path":"UniVTAC_insert_hole/train_val_split.json","sha256":"0000000000000000000000000000000000000000000000000000000000000000"},{"path":"norm_params_snapshot.json","sha256":"0000000000000000000000000000000000000000000000000000000000000000"},{"path":"share_norm_stats_all_t0_zscore.json","sha256":"0000000000000000000000000000000000000000000000000000000000000000"}],"normalization_root":"/absolute/RoboTactile/deployment/artifacts/models/ftp1_policy/FTP1_UniVTAC_insert_hole_expert_gsmall_ftp1/19999/normalization","normalization_tree_sha256":"e89edff6635a068a185a8160b56fd3e05b2f6a0e5e44808606fdf189057aa8d5","prompt":"insert the stick to the hole.","schema_version":"robotactile-ftp1-policy-artifact-v1","tactile_config_path":"/absolute/RoboTactile/deployment/artifacts/models/ftp1_policy/FTP1_UniVTAC_insert_hole_expert_gsmall_ftp1/19999/tactile_input_config_file.json","tactile_config_sha256":"0000000000000000000000000000000000000000000000000000000000000000","task_id":"insert_hole","temporal_ensemble_k":0.01,"train_config_path":"/absolute/RoboTactile/deployment/artifacts/models/ftp1_policy/FTP1_UniVTAC_insert_hole_expert_gsmall_ftp1/19999/train_config.json","train_config_sha256":"0000000000000000000000000000000000000000000000000000000000000000","use_tactile":true,"weight_license_status":"upstream_unspecified"}
